{
  "$schema": "https://json-schema.org/draft/2020-12/schema",
  "$id": "https://kody-w.github.io/rapp-vision/channel.schema.json",
  "title": "RAPP Vision paired publication channel",
  "type": "object",
  "required": ["schema", "id", "name", "videos"],
  "properties": {
    "schema": { "const": "rapp-vision-channel/2.0" },
    "id": {
      "type": "string",
      "pattern": "^[A-Za-z0-9][A-Za-z0-9._-]*$"
    },
    "name": { "type": "string", "minLength": 1 },
    "videos": {
      "type": "array",
      "minItems": 1,
      "items": { "$ref": "#/$defs/publication" }
    }
  },
  "$defs": {
    "source": {
      "type": "object",
      "required": ["src", "type"],
      "properties": {
        "src": { "type": "string", "minLength": 1 },
        "type": {
          "type": "string",
          "pattern": "^\\s*video/(mp4|webm)\\s*(?:;.*)?$"
        }
      },
      "allOf": [
        {
          "if": {
            "properties": { "type": { "pattern": "^\\s*video/mp4\\s*(?:;.*)?$" } },
            "required": ["type"]
          },
          "then": {
            "properties": {
              "src": { "pattern": "^(?![^?#]*(?:;|%3[bB]|%2[fF]|%5[cC]))[^?#]*\\.mp4(?:[?#].*)?$" }
            }
          }
        },
        {
          "if": {
            "properties": { "type": { "pattern": "^\\s*video/webm\\s*(?:;.*)?$" } },
            "required": ["type"]
          },
          "then": {
            "properties": {
              "src": { "pattern": "^(?![^?#]*(?:;|%3[bB]|%2[fF]|%5[cC]))[^?#]*\\.webm(?:[?#].*)?$" }
            }
          }
        }
      ]
    },
    "chapter": {
      "type": "object",
      "required": ["t", "label"],
      "properties": {
        "t": { "type": "number", "minimum": 0 },
        "label": { "type": "string", "minLength": 1 }
      }
    },
    "action": {
      "type": "object",
      "required": ["at", "do"],
      "properties": {
        "at": { "type": "number", "minimum": 0 },
        "do": {
          "enum": ["click", "key", "keydown", "keyup", "type", "drag", "scroll"]
        }
      }
    },
    "publication": {
      "type": "object",
      "required": ["id", "title", "duration", "sources", "live"],
      "properties": {
        "id": {
          "type": "string",
          "pattern": "^[A-Za-z0-9][A-Za-z0-9._-]*$"
        },
        "title": { "type": "string", "minLength": 1 },
        "duration": { "type": "number", "exclusiveMinimum": 0, "maximum": 86400 },
        "chapters": {
          "type": "array",
          "items": { "$ref": "#/$defs/chapter" }
        },
        "sources": {
          "type": "array",
          "minItems": 2,
          "items": { "$ref": "#/$defs/source" },
          "allOf": [
            {
              "contains": {
                "properties": { "type": { "pattern": "^video/mp4(?:\\s*;.*)?$" } },
                "required": ["type"]
              }
            },
            {
              "contains": {
                "properties": { "type": { "pattern": "^video/webm(?:\\s*;.*)?$" } },
                "required": ["type"]
              }
            }
          ]
        },
        "live": {
          "type": "object",
          "required": ["kind", "scenes"],
          "properties": {
            "kind": { "const": "rapp-vision-live/1.0" },
            "duration": {
              "type": "number",
              "exclusiveMinimum": 0,
              "maximum": 86400
            },
            "chapters": {
              "type": "array",
              "items": { "$ref": "#/$defs/chapter" }
            },
            "scenes": {
              "type": "array",
              "minItems": 1,
              "items": {
                "type": "object",
                "required": ["t", "dur"],
                "properties": {
                  "t": { "type": "number", "minimum": 0 },
                  "dur": { "type": "number", "exclusiveMinimum": 0 },
                  "card": { "type": "object" },
                  "app": {
                    "type": "string",
                    "oneOf": [
                      {
                        "format": "uri",
                        "pattern": "^https://(?:[A-Za-z0-9.-]+|\\[[0-9A-Fa-f:.]+\\])(?::(?:[0-9]{1,4}|[1-5][0-9]{4}|6[0-4][0-9]{3}|65[0-4][0-9]{2}|655[0-2][0-9]|6553[0-5]))?(?![^?#]*(?:;|%3[bB]|%2[fF]|%5[cC]))(?:/[^\\s\\\\?#]*)?(?:[?#][^\\s\\\\]*)?$"
                      },
                      {
                        "pattern": "^(?![A-Za-z][A-Za-z0-9+.-]*:|//)(?!.*\\\\)(?![^?#]*(?:;|%3[bB]|%2[fF]|%5[cC]))[^\\s?#][^\\s]*$"
                      }
                    ]
                  },
                  "ready": { "type": "object" },
                  "actions": {
                    "type": "array",
                    "items": { "$ref": "#/$defs/action" }
                  }
                },
                "oneOf": [
                  { "required": ["card"], "not": { "required": ["app"] } },
                  { "required": ["app"], "not": { "required": ["card"] } }
                ]
              }
            }
          }
        }
      }
    }
  }
}
